{"$schema":"https://json-schema.org/draft/2020-12/schema","$id":"urn:vibemind:shared:contracts:research-idea-handoff:v1","title":"ResearchIdeaHandoffV1","type":"object","additionalProperties":false,"required":["contract_version","handoff_id","result_id","evidence_refs","approval_ref","idea_summary"],"properties":{"contract_version":{"const":"v1"},"handoff_id":{"type":"string","pattern":"^handoff_v1_[0-9A-HJKMNPQRSTVWXYZ]{26}$"},"result_id":{"type":"string","pattern":"^result_v1_[0-9A-HJKMNPQRSTVWXYZ]{26}$"},"evidence_refs":{"type":"array","minItems":1,"uniqueItems":true,"items":{"type":"string","pattern":"^evidence_v1_[0-9A-HJKMNPQRSTVWXYZ]{26}$"}},"approval_ref":{"type":"string","pattern":"^approval_v1_[0-9A-HJKMNPQRSTVWXYZ]{26}$"},"idea_summary":{"type":"string","minLength":1,"maxLength":4000}}}
